"","text","positive","negative","assigned"
"1"," If a college forces the vaccine, they should be sued out of existence.  Wreck less, fraud, deliberate withhold of facts on an experimental drug against a low risk illness does not allow schools immunity from suit",0,1,"Negative"
"2"," My Deans List Sophomore unwelcome at her college w/o Covid vaccine.  She recovered on campus 2/2021!   Help us",0.5,0.5,"Negative"
"3"," are you paying out if your personal pocket for those college scholarships you gave away to people who got covid vaccine? I dont want my state tax dollars funding bribery",0,1,"Negative"
"4"," please help my daughter in #NJ () return to college.  Shes declined vaccine as she recovered (on Campus) 2/2021",1,0,"Positive"
"5","Deathsantis say vaccine cards are wrong.. But they are mandating your party affiliation for college? Hmmm  stay off of third floors, never know when you could fall out of a deathsantis window! ",0.652439024390244,0.347560975609756,"Positive"
"6","Mandy Roberts wears many hats! She is a Centennial College graduate.She is a program PAC member.She is a compounding teaching assistant.And today, what is this? Mandy is on a TTC bus drawing up vaccine doses for TTC workers!WOW Mandy we are truly in awe!#pharmacytechnician ",1,0,"Positive"
"7"," Why doesnt  organise community pharmacy to start vaccinating that age group now? #FirstDoseForFirstYears Get them all done before they head off to college    Leave the vaccine centres and GPs to carry on as they are.",0,1,"Negative"
"8"," As a Rutgers College alumnus I support your refusal to accept the mandatory vaccination with the experimental and potentially dangerous vaccine.  Great job.",0.774346793349169,0.225653206650831,"Positive"
"9"," Someone on our college parents board - objecting to the university announcing theyre requiring vaccines for the coming year - used her body, her choice about her daughter applying for medical/religious objection to the vaccine. I preemptively blocked that parent.",0,1,"Negative"
"10","   Not necessarily.  I know two school teachers, a nurse and several people in business who refuse the vaccine, all college educated.Its crazy.",0,1,"Negative"
"11","It is not worth the risk. The Pfizer vaccine is not safe. Im really concerned about all of the college students going back to campus and these universities mandating vaccines...Mother of teen with heart damage. ",0.199115044247788,0.800884955752212,"Negative"
"12","Why these 3 new #COVID19 college and university vaccine mandates in Rhode Island and West Virginia may be significant ",1,0,"Positive"
"13","VT Health Commissioner Dr. Mark Levine, on the difficulty of getting 18 to 29 year olds not in college vaccinated: Most of them are not a truly vaccine-resistant group Its just not at the top of their list right now. ",0,1,"Negative"
"14"," Thank you so much! My children attend a college where the vaccine has been mandated.  I hope, given this report, that they will resend the rule.",1,0,"Positive"
"15","  It is new, because this vaccine isnt FDA approved and the long-term effects are unknown. Can girls in their 20s who need it for college, have children later in life? I dont know! You dont know! And the medical community doesnt know! Im not anti-vax, Im anti-mandate.",0,1,"Negative"
"16","Highline College has joined numerous other colleges and universities around the country to take the #COVIDCollegeChallenge pledge and commit to action. Get the COVID-19 vaccine, Thunderbirds! #WeCanDoThisLearn more: ",1,0,"Positive"
"17","The PRCs goal is to reduce vaccine hesitancy and increase vaccine uptake in Clarkston by 50 percent by spring 2022. ",0.547368421052632,0.452631578947368,"Positive"
"18","when ur state insurance doesnt cover the vaccine you need for college &lt;3 god bless the usa ",1,0,"Positive"
"19","  The reason people under 30 havent been hit as hard - theyre college age &amp; schoolkids who werent as exposed to the virus as older adults. The schools &amp; colleges were learning remotely, especially until older adults had a vaccine. The vaccine adults got helped keep kids safe.",0.747663551401869,0.252336448598131,"Positive"
"20"," Agree. My college student\s school has a vaccine incentive program. Such as free tuition and other gifts. Who knows what will happen to her when she gets older.",1,0,"Positive"
"21","    Vaccine Passport illegal but survey to gather political data on college students its okay-",0.505703422053232,0.494296577946768,"Positive"
"22","I chose to get the COVID19 vaccine not only for my own protection and health but also to protect those around me . . . choosing to get the vaccine protects me and the more vulnerable populations I interact with. - Annika Bassey, Harvard College, 22 ",0.693181818181818,0.306818181818182,"Positive"
"23","  Look at those red numbers.  That is the incidence post-vaccine compared to what is typical without it.  The FDA is recommending warning kids about the risks but what good is that if they are being forced to get them in order to attend college? ",0.347417840375587,0.652582159624413,"Negative"
"24"," But heaven forbid suggesting a college student get the Covid vaccine, right ?",0.601049868766404,0.398950131233596,"Positive"
"25","   Does it advise on how to deal with the bullying of a college to mandate an emergency use vaccine which puts children and college kids at risk of death, myocarditis, seizures, etc...?",0,1,"Negative"
"26"," Youre not correct. He is the worst. Are You going to put your political beliefs on a college application. How about the Trans Rules? How about no vaccine proof needed at work and cruises? THe list is tooooooo long. Hes a bad guy. #RemoveRon",0,1,"Negative"
"27","theres NO WAY students should be deprived of a college education because of an OPTIONAL vaccine",0,1,"Negative"
"28"," LITERALLY just told someone else I bought drugs from him in college lmaoooooo like seriously dont worry whats in the vaccine u take any type of pill sir",0.742574257425743,0.257425742574257,"Positive"
"29"," But if the college world is anything like MY industry, in every survey my patrons tell me they wont come back until they are assured that everyone else attending has been vaccinated. ",1,0,"Positive"
"30","Mumbai vaccine scam: Fourth FIR lodged, sixth accused arrested for holding unauthorised camp in Borivali college ",0,1,"Negative"
"31","   I agree with you on college vaccine mandates. Dont think we have strong enough data to support that",1,0,"Positive"
"32","      Thanks  thats useful to see. Although with no vaccine plan for 16-18s, college students remain in the firing line.",0.558375634517767,0.441624365482233,"Positive"
"33","Union County College is hosting a free vaccine clinic on Wednesday, June 30th at their Cranford campus. The event will also feature giveaways and raffles for prizes such as gift cards, laptops, and free tuition for students.",1,0,"Positive"
"34","Mumbai vaccine scam: Fourth FIR lodged, sixth accused arrested for holding unauthorised camp in Borivali college || SnowflakeYT || ig_sfg || SnowflakeYT || Sonu8726 ",0,1,"Negative"
"35","Wheres the national GOP taking a hardline stance against mandatory vaccination being forced at college students &amp; workers?Theyre too busy tweeting #JuneTeenth hashtags, bragging about vaccine sales &amp; taking selfies with Caitlyn Jenner. Why do people think they care?",0.620111731843575,0.379888268156425,"Positive"
"36","  May I know what kind of vaccine will be given for 2nd dose on June 24 at Seneca colleges Newnham location?  Thank you",1,0,"Positive"
"37","a really unpopular opinion ive developed all year: im aggravated that bill gates keeps pushing a vaccine when hes not a doctor or medical professional and is a college drop out. leave it to doctors and stop budding in. google to this day still says the survival rate is 99.8%.",0,1,"Negative"
"38"," My family has no idea, zero, what vaccinations I get...unless I tell them. These people can get the vaccine and keep quiet about it. Even kids who have anti vaccine parents are going out and getting all their vaccines without the parents knowing. They need them for college.",0,1,"Negative"
"39","Just got my second vaccine shot in a college gymnasium with Backstreet Boys - I Want It That Way playing in 128kbit MP3 quality on the doctors phone next to me. And, reader, I did want it that way",1,0,"Positive"
"40","College is not a right its a privilege. If you dont want a vaccine dont go or pick another school.Stop being selfish assholes.",0.23463687150838,0.76536312849162,"Negative"
"41","Isnt vaccination free for front line workers in Bangalore especially for doctors? PG students in vydehi medical college have compulsory covid duty and they have to pay for the vaccine..     ",0,1,"Negative"
"42","To enjoy an uninterrupted fall sports season...teens and college students should get their two-dose series of Pfizer COVID-19 vaccine by June 27th, to be fully vaccinated by the Aug. 1 practice date. Schedule today at ",1,0,"Positive"
"43","Take a look at this opportunity!  #student #chicago #college #Lollapalooza #vaccine ",1,0,"Positive"
"44","   vaccine ok . College yaake .",1,0,"Positive"
"45","#legal ",1,0,"Positive"
"46"," So no vaccine passports bc of privacy concerns but survey college students on their views and collect the information? No, no hypocrisy there.",0.57051282051282,0.42948717948718,"Positive"
"47"," The #IndianaUniversity students have every right to refuse the COVID vaccine, and they equally have the right to shlep burgers as college dropouts#FuckEm",0,1,"Negative"
"48","Our government is a disgrace! I have a son who is in college in Romania, and one who is going to Rowan University in the fall. The vaccine is voluntary for students in the former communist country while in the land of free, the vaccine is mandatory to attend college. ",0.605442176870748,0.394557823129252,"Positive"
"49","We were so excited to have  partner with the White House to support Forsyth Technical Community College by providing $25 in GoPuff credits to community members working, volunteering, or receiving a COVID-19 vaccine at our clinic! Thank you, GoPuff!! #APlaceOfPromise ",1,0,"Positive"
"50"," Awesome interview Ana with the lawyer for the unvaccinated IU students! The thing I love about your interviews is you really challenge the other side and imo there is no defense for NOT getting the vaccine prior to starting up in college in the fall. Great job Ana!",0.913533834586466,0.0864661654135338,"Positive"
"51","Niggas take the vaccine and act like they just graduated college",0.509915014164306,0.490084985835694,"Positive"
"52","Right headline: Colleges should get students vaccinated. Why are some still not doing so?Stop framing stories like this. Im thankful Im going to a college that is encouraging vaccinations, but it should be a requirement. ",1,0,"Positive"
"53","  The  did the same about face on their Initial recommendation that pregnant women not get the vaccine after getting pressure from American college of obstetricians &amp; gynecologist.",0,1,"Negative"
"54","I dont think that you should be forced to get the COVID19 vaccine to go to college, that wrong and something needs to be done about that, my body my choice!",0,1,"Negative"
"55","Not sure why no one is talking about this. They were canceling college athletics because of a very few cases dude to Covid yet an astronomical number caused by vaccine and silence. Not saying vaccine is bad but I know the below isnt good for sure ",0.218340611353712,0.781659388646288,"Negative"
"56"," Sir you cant start the college As the Delta variant has arrived Youre putting students lives in dangerous as the vaccine is not more effective against delta variant    ",0,1,"Negative"
"57","college could miss me with the vaccine requirements . ya not bouta make me get something that i dont want . fuck all ya",0.502347417840376,0.497652582159624,"Positive"
"58","* Two from #LongIsland were among 10 to win a full ride to any SUNY or CUNY school after getting a COVID-19 vaccine. #DailyVoice ",1,0,"Positive"
"59","* Two from #SuffolkCounty were among 10 to win a full ride to any SUNY or CUNY school after getting a COVID-19 vaccine. #DailyVoice ",1,0,"Positive"
"60",", along with many other schools, is removing most restrictions for students with the Covid-19 vaccine. With #college #move-in being short months away, demand for vaccines continues for students. #dormmoving #dorm #collegemoving",0,1,"Negative"
"61","Students suing Indiana University over their vaccine mandate because its against their constitutional rights. Please tell me where in the constitution it says its a constitutional right to go to college?!?",0.583892617449664,0.416107382550336,"Positive"
"62","idk why these college and universities are making it mandatory for students to get this vaccine.",0.481481481481481,0.518518518518518,"Negative"
"63","  Also most of your understanding of COVID is based off the Alpha variant.  The Delta variant which is the dominant one targets younger adults.  As a college educated adult I took the vaccine because it is the smart thing to do.",1,0,"Positive"
"64","[BC] Hey #Vancouver!! Swing by Vancouver Community College for your vaccine and enjoy some live music! ",1,0,"Positive"
"65","Free college sound good to you? For anyone 12-17 years old, get the vaccine, then take your shot at one of nine (yes9) $100,000 scholarships. Visit ",1,0,"Positive"
"66"," One of my friends daughters did have some myocarditis post vaccine. She recovered well anc is still very happy to have vaccine mediated virus protection as she returns to college.",1,0,"Positive"
"67","Hey Vancouver! If you still need a first-dose COVID-19 vaccine, come by todays drop-in clinic to get your shot and enjoy some live music. Vancouver Community College - 1199 E 7th Avenue, Vancouver 9 a.m. to 6 p.m. 400 drop-in spots available ",1,0,"Positive"
"68","My college is now giving people $150 of bookstore credit to get the vaccine.No one gave me cool deals when I got vaccinated in February! Especially not for my textbooks.",1,0,"Positive"
"69","  im sorry u have to go through this! Senior hs &amp; freshman college are such memorable important years, I cant imagine having mine during the pandemic. Do u think vaccine delivery will improve soon enough for u to leave for school???",0.689655172413793,0.310344827586207,"Positive"
"70","Yes! Im so glad you said college students! Our college is gonna require students take the vaccine to return to campus and I dont want it! I already got covid! I needed the vax before I got covid lol ",0.896414342629482,0.103585657370518,"Positive"
"71","I hope yall not taking the vaccine just to go back &amp; finish your schooling / college courses .. thats a big mistake .. real spill",0.546961325966851,0.453038674033149,"Positive"
"72","   Shit , do you recommend some drug over vaccine which college did you graduate from  you are antivaaaaaaaax as simple as that",0.408888888888889,0.591111111111111,"Negative"
"73"," Kindly reply to my tweet regarding the date of 2nd dose of Covaxin at Jorhat College. I took the vaccine on 20-06-2021 but it has come 22-06-2021 in the certificate. Kindly make the due correction. ",1,0,"Positive"
"74","What does this mean for thousands of college students being forced into taking the vaccine?  What does this mean for our collegiate athletes? How many students will have to die before the CDC acts in the interest of our children?  Maybe a gap year should be seriously considered. ",0.24537037037037,0.75462962962963,"Negative"
"75","   Many people are being forced to get the vaccine to do many important things like work or finish college. The vaccine has actually killed many people  &amp; given many more health problems, including young people who wont be hurt by covid. You are ignorant &amp; rude",0.3125,0.6875,"Negative"
"76"," Do you know which vaccine will be administered at the Seneca College Newnham campus tomorrow June 24? Thanks!",1,0,"Positive"
"77","The 10 winners of a full scholarship to a SUNY or CUNY college or university. These are young folks age 12-17 who got their first vaccine dose and entered the drawing. Final drawing next week. ",1,0,"Positive"
"78","Why are we forcing students (MS thru college) to get a vaccine that is proving itself to be harmful when they have great success rates against C19 CDC finds more cases of rare heart inflammation than expected after Covid vaccine shots  ",1,0,"Positive"
"79"," No Vaccine, No school/college, No exams.#VaccinationDrive is first &amp; top most priority for all ages.Give vaccine 2doses, open whatever you want.",1,0,"Positive"
"80","Likely never get vaccine via new Monmouth poll:35% conservatives26% Republicans25% men25% no college22% non-white21% all Americans20% white17% under 35 years old17% women14% college grads11% over 65 years old6% Democrats6% liberals",0,1,"Negative"
"81"," Transfer to trump univ. or some christian college that might not require vaccine. when you entered kidergarten, you were required to be vaccinated against, mumps,polio,rubella,measles,small pox, etc.. This is no different than kindergarten, except half the country is brainwashed.",0,1,"Negative"
"82","Collin College is offering a COVID-19 vaccination clinic at the Collin Higher Education Center on Saturday, June 26, with the one-dose Johnson &amp; Johnson vaccine. No cost to participants. Open to the general public.",0,1,"Negative"
"83"," why is this okay? maybe dont force people who actually need money into getting the vaccine because they dont want it but have to bc theres a chance for money. fund it into kids who need money for college coming out of this pandemic? or maybe homeless ppl?",0.798165137614679,0.201834862385321,"Positive"
"84","Want to win $1 million or a college scholarship in the #MassVaxMillions Giveaway? You must be fully vaccinated to be eligible. Registration begins July 1 and if you arent vaccinated, you cant win! Make a #COVID19MA vaccine appointment today: ",0.636842105263158,0.363157894736842,"Positive"
"85","  the vaccine b/c of all of the risks but her college forced her to get it.  She went on to sort of equate risk from Covid infection to risks of vaccine. This is supposedly a medical professional? Its just so hard to understand how so many walk around misinformed.",0,1,"Negative"
"86","Companies arent the only ones facing a vaccine requirement conundrum. Colleges are facing a similar situation with students, and campuses are riskier due to the diversity of the population and living arrangements ",0,1,"Negative"
"87"," Im a liberal Independent, majored in biology,  and took a mandatory flu vaccine before starting college in 1976, shortly after I turned 17, which damned near killed me.Even the CDC recommends that I NOT get the Covid vaccine, because of my life-threatening response to that one.",0.246808510638298,0.753191489361702,"Negative"
"88","We are doing this for every student, faculty, and staff member at our college. LCOOC is taking the pledge and committing to action. Get the COVID-19 vaccine. #WeCanDoThis #COVIDCollegeChallenge ",1,0,"Positive"
"89","My son feels like hes having a heart attack 24/7, Follmer said. He now has high blood pressure, severe chest pains, back pain, elevated kidney levels, hypothyroidism, inflamed lymph nodes in different areas of his body, and he cant work or exercise.",0.131428571428571,0.868571428571429,"Negative"
"90"," also FWIW shingles is an absolutely dreadful virus, and i had a professor in college who came down with a nasty case of it in his late 50s, and he terrified every single one of us in his class to get our shingles vaccine when our time comes. he really regretted not getting his!",0,1,"Negative"
"91"," Absolutely you are right. They should stop mandating Covid-19 vaccine for college students and grade school students. The entire Covid-19 vaccine program should be stopped. Too many dangerous side effects and death. This is Claire Gavrel",0,1,"Negative"
"92","Maybe Ill have my first dose of the vaccine by my birthday!! People 20+ can start applying after July 3rd, but since Im away at college and need to get it at my place of residence, I can only do it after I leave, but this is really cool, cant wait",0.553846153846154,0.446153846153846,"Positive"
"93","Schools do not know the percentage of students who have received various vaccines; a more comprehensive assessment of vaccine coverage of college students is required.",1,0,"Positive"
"94"," Meanwhile a college student and resident in Washington State can get a free joint for getting their vaccine. How fucked up is this country? So fucking stupid. Smear this guys name and put him in jail for marijuana. Hey, but they handing out guns in Texas. ",0.229050279329609,0.770949720670391,"Negative"
"95","Its also the time of year ppl have to get vaccine boosters for college and thats usually one of the highly recommended onesstrange",1,0,"Positive"
"96","In 2020, a subsidiary, the American College Health Foundation, formed a working group of health professionals and charged them with assessing vaccine readiness and coverage at U.S. colleges and universities. This project was underwritten by Pfizer, which provided $120,000",0.526881720430108,0.473118279569892,"Positive"
"97","Olivet College is proud to be a member of the COVID-19 College Vaccine Challenge hosted by the White House and the U.S. Department of Education. Visit ",1,0,"Positive"
"98","Indiana University Students Sue Over Covid-19 Vaccine Requirement. You know that going to any particular college is voluntary, right? Like, if you choose disease and death, why not apply to Liberty University? ",0.262096774193548,0.737903225806452,"Negative"
"99","I find it very concerning that my college is pushing very hard about getting the vaccine. If theyre going to require online students to get the vaccine just to be admitted, Ill find another school. Im not taking that shit.",0.489795918367347,0.510204081632653,"Negative"
"100","Kirk Ferentz and five Hawkeye players met the media Tuesday, in person without masks. Chad Leistikow offers some of the top takeaways we learned. ",1,0,"Positive"
"101","Camp counselor shortage, airlines cut flights and raise prices, and college students sue over mandatory vaccines. Much more in  newsletter -------&gt; ",0.471337579617834,0.528662420382166,"Negative"
"102","We feel like we have a couple guys that can go at quarterback, a notable step forward for Alex Padilla, Ferentz says while offering encouraging remarks on Deuce Hogan, too. 6 thoughts/observations out of Hawkeye football interviews last night. () ",1,0,"Positive"
"103","The first drawing of the NC Vaccine lottery will occur today. The winner will receive One Million Dollars. Three more drawings will occur this summer through August 4, 2021. Vaccinated children (12-17) could also win $125,000 for college costs.",1,0,"Positive"
"104","  Those who are most hesitant to get the coronavirus vaccine include white evangelicals, Republicans, rural Americans, young adults and those without college degrees.",0,1,"Negative"
"105","Are you university/college-aged and worried about myocarditis from an mRNA vaccine? Worry more about myocarditis from covid. Vaccination is still less of a risk. ",0,1,"Negative"
"106","Regardless of what our fucking retard of a premier said there is no scientific backing that its ok to mix vaccine doses. Pls listen to the scientists and not a college dropout ",0.435344827586207,0.564655172413793,"Negative"
"107","MONEY HONEY : NC officials will pick the winners of the first round of the $1M coronavirus vaccine lottery today. The winner wont be revealed for a few days. One lucky vaccinated teen will also win a $125,000 college scholarship. ",1,0,"Positive"
"108"," Ever since this pandemic came out there is no mention of other virus flu an only hear about the convid an a making scheme an making kids who want to go to college get the vaccine which isnt right at all ..its just money going into greedy pockets an anything to make a dollar",0.154929577464789,0.845070422535211,"Negative"
"109","Students not smart enough to be in college or even to operate machinery. ",0,1,"Negative"
"110"," So the usual  response, he didnt answer the question and spoke about the vaccine programme. But this story sounds an interesting development.",1,0,"Positive"
"111","Measles vaccine may protect children against Covid-19, finds study by Pune researchers ",1,0,"Positive"
"112","A 21-year-old student who developed myocarditis after his second Moderna shot.a 19-year-old college freshman who died from heart surgery required after she developed myocarditis following her second Moderna vaccine.",0,1,"Negative"
"113"," It is an experimental vaccine, they used to pay starving college students to try this shit first. The coersion by the government is insane and since people are skeptical, look everyone a newer deadlier variant in the news this week. Fuck all that nonsense.",0,1,"Negative"
"114"," Let me be clear means let me feed you bullshit! Moderna sent the vaccine two weeks before the virus came out to NC college.",0.389380530973451,0.610619469026549,"Negative"
"115"," ONS reported 91% vaccine positivity on 7th FebOxford University 80% of all adults 23rd FebImperial College (!!!) 77% 21st FebBMJ 90% 14th FebThese are of adult  measuresI could go on",1,0,"Positive"
"116","Fourth FIR in fraudulent vaccine camps case-- this time at Borivali police stn. It pertains to a vaccine camp at Aditya college in Borivali on June 3 where staff &amp; their families had been given shots.  Ex Kokilaben Ambani Hospital employee Rajesh Pandey is  booked. ",0,1,"Negative"
"117","Mumbai vaccine scam gets murkier. 4th FIR in at Borivali police stn. Fake vax camp at Aditya College on June 3. Former Kokilaben Hosp staffer Rajesh Pandey booked.",0,1,"Negative"
