"","text","positive","negative","assigned"
"2946","Gov. Gretchen Whitmer detailed the MI Shot to Win Sweepstakes this morning, outlining a lottery-style raffle that will give vaccinated Michiganders a shot at cash prizes or money for college. ",1,0,"Positive"
"2947","  All respects sir! Do you think vaccine is enough for your ward! Once the college reopen date announce, there will be mass movement in karnataka and in current situations personally i dont think its safe to go out and attend college",0.435897435897436,0.564102564102564,"Negative"
"2948","Colleges Say Students Must Get a Covid Vaccine. But No, Not That One. ",0,1,"Negative"
"2949","Gov. Whitmer announces Michigan vaccine lottery. Prizes to be won:- (30) $55k daily prizes over a thirty day period- (1) $1M prize drawing- (1) $2M prize drawing- (9) $55k college scholarships ",1,0,"Positive"
"2950","NOW:  announces new statewide vaccine incentive MI Shot to Win Sweepstakes -Any vaccinated Michigander can enter to win-Prizes include $5M in cash and college scholarships -Currently 62% of Michiganders have received at least one dose  ",1,0,"Positive"
"2951","Gov. Gretchen Whitmer is about to outline a plan for a Michigan COVID-19 vaccine sweepstakes called MI Shot to Win. The prizes total about $5 million and include nearly $500,000 in college scholarships for Michiganders who are younger than 18 and have been vaccinated.",1,0,"Positive"
"2952","If your kiddo is age 12+, there is no reason why they shouldnt have a completely normal back-to-school this August, whether they are headed to middle school, high school, or college (where they, too, can learn from a football mascot)! Get that vaccine!",0,1,"Negative"
"2953","The govt that told us Saddam had WMDs, grains should be the staple of our diet, college debt is a great idea, allowing syphilis to run its course on black people is ok, and that Trump is a Russian spy, is now telling us to get the Covid vaccine.You can only lie so much.",0.72,0.28,"Positive"
"2954",". if you truly do not support  #VaccineMandate, you could stop it for all state universities. Gov. Duceys executive order bans COVID-19 vaccine requirement, mask mandates at public universities, colleges",0.392523364485981,0.607476635514019,"Negative"
"2955","Doug Moses, M.D. (95), associate dean for Admissions and Student Affairs, College of Medicine, shares why he chose to get the #COVID19 vaccine: ",1,0,"Positive"
"2956","Gov. Gretchen Whitmer plans to announce details of a COVID-19 vaccine sweepstakes that will give vaccinated Michiganders a chance to win a combined total of more than $5 million in cash or one of nine college scholarships.  ",1,0,"Positive"
"2957","Gov. Gretchen Whitmer plans to announce details today of a COVID-19 vaccine sweepstakes that will give vaccinated Michiganders a chance to win cash or a college scholarship.  ",1,0,"Positive"
"2958","#vaccinatedandhappyExcept for the few who were infected, Dhempe College administrative staff are now 100% vaccinated for #COVID19 with at least first dose of the vaccine. #dhempeatsixty #dhempedynamites #dhempecollege     ",0,1,"Negative"
"2959","Gov. Gretchen Whitmer plans to announce details today of a COVID-19 vaccine sweepstakes that will give vaccinated Michiganders a chance to win a combined total of more than $5 million in cash or a college scholarship.  ",1,0,"Positive"
"2960","Michigan gov. announces COVID vaccine lotteryAccording to the governors office, the sweepstakes will give vaccinated residents a chance to win a combined total of more than $5 million in cash and nine $55,000 college scholarships through a lottery raffle.",1,0,"Positive"
"2961"," Hi Arian, we encourage that only those who are 12 or older who live, work or attend school in Etobicoke book at the Osler-Humber College Vaccine Clinic.",1,0,"Positive"
"2962","Michigan will be offering cash &amp; college scholarship incentives for residents who receive a at least one COVID-19 vaccine shot. More details on  ",1,0,"Positive"
"2963"," Americans are stupid.  THEY ARE KILLING YOU AND YOUR FAMILY WITH VACCINE. Where are the College Students ?  Is there NO INTELLIGENCE ?What good is College ? HOW FUCKIN STUPID CAN YOU BE ? WHERE IS MIT, HARVARD UNIVERSITY, SUFFOLK UNIVERSITY - LAW SCHOOLS ? Wake up.",0.128571428571429,0.871428571428571,"Negative"
"2964","Grab-a-jab today at #Calderdale College No appointment needed.! 9:30am-4pm Pfizer vaccine, first and second doses (if 8 weeks since your first)For more details visit ",0,1,"Negative"
"2965","You can now sign up to win a million dollars or a college scholarship, if you live in Massachusetts and are fully vaccinated against COVID-19. ",1,0,"Positive"
"2966","   Sir , why are we not starting colleges ? All students who go to college are above 18 and are being vaccinated! If we start the colleges, students will also start getting motivated for vaccine and will not have the excuse to postpone the exams",0.469230769230769,0.530769230769231,"Negative"
"2967","We have a way out of this mess right now, and thats the vaccine.Briggs: Don\t want the vaccine? Fine, but be prepared to let down your teammates ",0.736607142857143,0.263392857142857,"Positive"
"2968","Hey, Massachusetts residents -registration for VAXMILLIONS starts today. You have a chance to win $1m or college scholarships - if you are fully vaccinated. #vaccine #Shot #jab ",1,0,"Positive"
"2969","When physicians are silenced, diagnoses will be in jeopardy. If patient presents with the likelihood of a reaction, e.g., from a vaccine dose(or booster, now proposed), the obvious could be ignored out of an abundance of caution&amp;fear of college repercussions. ",0,1,"Negative"
"2970"," I have two daughters, one in college and one just completed her leaving cert, both have worked so hard on exams &amp; pt jobs and both listened to the guidelines, however both have had enough &amp; these vaccine privileges are a step too far.",0.604395604395604,0.395604395604396,"Positive"
"2971","****does anyone know how i can get a religious exemption from taking the vaccine?****i really want to go back to college and finish my education but i dont want to take a vaccine that took less than a year to develop. please comment or dm me any info you have to help me",0.853503184713376,0.146496815286624,"Positive"
"2972"," Joe Biden gave students entering college a free 2 years off their 4 years to encourage them to take the vaccine.",1,0,"Positive"
"2973","Whats the best way to recover from an all-nighter? I was up until 2am for the article linked below talking with my ace editors at  Now Im a zombie. How do you kids recover from lack of sleep? Im definitely not a college student now. ",0.758064516129032,0.241935483870968,"Positive"
"2974","i wasnt able to attend my only class today because i lined up for my vaccine but hey still cant believe im down to my last year of school ever BUT FR college has been really amazing and it wasnt for rona it would be 19237383x more",1,0,"Positive"
"2975"," Sir we all college students humbly requesting u to promote us and we have also have facts and its genuine sir there is lots of students today who sat for exam and pain is there all over there body because of vaccine .Sir all college students want promotion please listen us .",0.654320987654321,0.345679012345679,"Positive"
"2976","Vaccine no stock at government vaccine centers, but vaccines available at colleges sponsored by local leaders. College should order their own vaccine? Are these government centers vaccine? Cowin portal shows no vaccine in Hoskote  ",0,1,"Negative"
"2977"," We are getting not really a wave except local outbreaks in areas with a lower vaccine rate .Most adults and teens want the shot at some point vaccines are required at work and college. Also more important we and Canada are reopening for Europe, Mexico and UK in a couple of weeks",0.603960396039604,0.396039603960396,"Positive"
"2978","  We are getting not really a wave except local outbreaks in areas with a lower vaccine rate .Most adults and teens want the shot at some point vaccines are required at work and college. Also more important we and Canada are reopening for Europe, Mexico and UK in a couple of weeks",0.603960396039604,0.396039603960396,"Positive"
"2979","MI  expected to launch the MI Shot to Win Sweepstakes -- a vaccine incentive program to encourage more Michiganders to get the COVID vaccine, with a chance to win a combined total of more than $5M and *nine* $55-thousand dollar college scholarships. #lottery #vaccine ",1,0,"Positive"
"2980","Although If vaccine came, it wont be 100% efficient. India recovery rate is quite good and education sector create the largest employment. It is better to educate the youth rather than allowing them to roam.#Open_College    ",0.778656126482213,0.221343873517787,"Positive"
"2981","Get your copy of  to read all about Tofes journey from migrant to mechanic. Plus the Vaccine Van is coming to College and  fights our corner to secure changes to Apprenticeship funding. ",0.468965517241379,0.531034482758621,"Negative"
"2982","  Sir, i would like to inform you that in GSVM Medical College vaccine centre , the people who have booked the slots and went to get vaccinated are being denied and those who have not booked the slots they are being vaccinated by taking Rs.250 from each",0.466666666666667,0.533333333333333,"Negative"
"2983"," I have a question - why on earth is anyone going to take medical advice from you?I mean, the reason youre confused by vaccine science is because you werent very successful at school/college ",0,1,"Negative"
"2984"," Mam you could see , what is happening at vaccine centre Girls Government polytechnic College Shamli near s.t.r.c public school.Thats why people dont trust on government working system.      ",0,1,"Negative"
"2985","I am here since 9:15 AM but Vaccination not started yet. Simply want to ask why given to Slot 9:00 AM ?Place- Govt Junior College, Wanaparthy District, Telangana State.   #VACCINE ",1,0,"Positive"
"2986","While the government is working aggressively on vaccinating college students and adults, the staffers at health centres  both government and private  are seeing the youth preferring #CovishieldVaccine over others.",0,1,"Negative"
"2987","This is ridiculous.  We have to bribe people to get a lifesaving vaccine like credit card companies used to bribe college students with free t-shirts to open accounts?   ",0.579345088161209,0.420654911838791,"Positive"
"2988","The state of West Virginia is and I quote Giving away souped-trucks and college scholarships!!! if you get the Covid vaccine. I- what......",1,0,"Positive"
"2989"," The following bottles of vaccine doses were thrown at the back of KK College ground.Kindly dispose it with a proper process and place.. ",1,0,"Positive"
"2990","A friend of the familys son got his vaccine for college, a requirement.He got it and complained of body aches and injection site pain immediately following.The next morning, the father found him dead in his bed with blood poured out every orifice.No thanks, Scott. ",0.331288343558282,0.668711656441718,"Negative"
"2991","Michigan to offer $5 million in prizes along with nine college scholarships ($55,000 a piece) for anyone whos had at least one COVID-19 vaccine.",1,0,"Positive"
"2992","This should give us some evidence on non-masking and COVID-19.And whether a college town is safe for opening without vaccine requirements. ",1,0,"Positive"
"2993","In addition to the gift cards that will be given away, NRG Park says those that are eligible, will also be entered into the drawing to win a $5,000 college scholarship through the Harris County Vaccine Scholarship Program. #khou",1,0,"Positive"
"2994","Adult Topic, Antivaxer College students and above Is there any material out there that you have found extremely useful to explain what a virus is, how a vaccine works at a middle school reading level?",1,0,"Positive"
"2995","Michigan Gov. Whitmer to announce MI Shot to Win Sweepstakes for chance to win cash, college scholarships - WDIV ClickOnDetroit ",1,0,"Positive"
"2996","Say what you want but schools who say you must have a vaccine to play a sport here for a virus that poses virtually zero threat to you is an absolute recruiting disadvantage compared to those who are not requiring it.",0.338582677165354,0.661417322834646,"Negative"
"2997","Safety concerns re #HPVvaccine has doubled since 2015 and what\s v interesting is that there was a statistically significant increase in the college educated mothers reporting safety concerns or adverse effects as the main reason for nonvaccination ",0.833333333333333,0.166666666666667,"Positive"
"2998","As we begin to approach a new college year now is the time to start thinking about getting your student ready to stay on campus. Visit ",1,0,"Positive"
"2999","  This is the narrative I want to hear about.  Not as it relates to college baseball, but the Titans. Clearly NC State would have been more competitive in this series. If Tannehill doesnt take the vaccine, how does that affect Nashville if he comes up positive before playoffs?",1,0,"Positive"
"3000","#reopencollege PLEASE OPEN COLLEGE INSTITUTE WITH VACCINE CERTIFICATE.      ",1,0,"Positive"
"3001"," college president smarter than you. Albertus Magnus College joins list of CT universities, colleges requiring COVID vaccine for students, staff ",1,0,"Positive"
"3002","During college I worked at The Disney Store in my local mall. Two weeks ago my Disney Store family lost one of our teammates to Covid. She &amp; her husband had decided to wait on the vaccine. Hes been in the hospital for 5 weeks now. Please get vaccinated if you havent and can. ",0.5,0.5,"Negative"
"3003","Michigan Gov. Whitmer to announce MI Shot to Win Sweepstakes for chance to win cash, college scholarships ",1,0,"Positive"
"3004"," Forcing college students to receive Covid vaccine in order to get an education is UNCONSTITUTIONAL!!!!! Shame on you!!! Universities should be mandated not to require vaccine. Its their bodies! Their choice! #prochoice RemindYouOfSomething? #NoMandatoryVaccination",0,1,"Negative"
"3005","#BreakingNews: Michigan Gov. Gretchen Whitmer plans to detail her MI Shot to Win COVID vaccine sweepstakes and college scholarship plan at a news conference tomorrow. Here\s what we know about it so far. The story for :",1,0,"Positive"
"3006","NEW: A Michigan vaccine lottery! will announce the MI Shot to Win Sweepstakes with  and  tomorrow.Vaccinated Michiganders could win a combined total of $5M+ in cash and nine $55k college scholarships.  ",1,0,"Positive"
"3007","College Students Suing Over State Universities Vaccine Mandates ",0,1,"Negative"
"3008","Bribes. Lies. Cheats. No informed consent. Shame on  Gov. Whitmer to announce COVID-19 vaccine sweepstakes for chance to win cash, college scholarships ",0.358565737051793,0.641434262948207,"Negative"
"3009","Gov. Gretchen Whitmer is expected to announce the launch of a the MI Shot to Win Sweepstakes -- a new incentive program to encourage more Michiganders to get vaccinated. ",1,0,"Positive"
"3010","NEW:  will announce launch of a vaccine incentive program, MI Shot  to Win Sweepstakes, giving vaccinated residents chance to win a combined total of more than $5 million in cash and nine $55,000 college scholarshipsvia a lottery-style raffle. ",1,0,"Positive"
"3011","BREAKING: Michigan to launch a vaccine lottery in partnership with Meijer and the United Way.$5 million in cash and 9 college scholarships up for grabs.",1,0,"Positive"
"3012","JUST IN: State of Michigan to launch vaccine incentive program Thursday to encourage more residents to get vaccinated MI Shot to Win Sweepstakeswill givevaccinated Michiganders chance to win $5 million in cash and nine $55,000 college scholarshipsvia a lottery-style raffle",1,0,"Positive"
"3013","New Poll Favors Janey, Wu In Mayoral Race; Former Boston College Coaches Still Earning Millions; Registration for Vaccine Lottery Begins This Week. ",1,0,"Positive"
"3014","we were discussing abt sarawak vs other state vaccination rates. Most of my friend not from sarawak wish they were in college/kota samarahan to get the vaccine in unimas. Even unimas handle 5000 jab a day",0.604166666666667,0.395833333333333,"Positive"
"3015","Consider the case of an 18 yo male who has had 1 dose of an mRNA vax against COVID and had PCR+ COVID in late 2020.He is concerned because a friend had myocarditis from vaccine and does not want to take 2nd dose.College/work mandates he take second dose are:",0.72093023255814,0.279069767441861,"Positive"
"3016","Column: Can college football help COVID vaccine division? - Los Angeles Times ",1,0,"Positive"
"3017"," Could you confirm if the vaccine clinic is open tomorrow at centennial college? Is walk in available for first dose? Thanks!",1,0,"Positive"
"3018"," I like him.",1,0,"Positive"
"3019","Athletes have the right to question a vaccine that the medical establishment tells us is safe and effective. But freedom of choice does not mean freedom of consequences.  ",0.682666666666667,0.317333333333333,"Positive"
"3020"," Does being right or wrong on this question change the risk benefit calculus re vaccines in low risk young people in your view (i.e. if great majority of college kids will get Covid dz over next several years if they dont have vaccine)?",0.43046357615894,0.56953642384106,"Negative"
"3021","College Vaccination Mandates do not Violate Medical Ethics, a blog in  to University Vaccine Mandates Violate Medical Ethics by Aaron Kheriaty  &amp; Gerard V. Bradley in ",0.451282051282051,0.548717948717949,"Negative"
"3022","Briggs: Dont want the vaccine? Fine, but be prepared to let down your teammates ",0.771241830065359,0.228758169934641,"Positive"
"3023"," Im fully vaccinated with an approved vaccine and Im arriving at Toronto airport on the 6th of July still my college is forcing me to quarantine for 14 days. What should I do? Please guide me.",1,0,"Positive"
"3024","  Broke college student who is homeless! I could use any help, Im crashing at my boyfriends and am waiting to get on unemployment, but got the vaccine and have complications following it. I need groceries and essentials thank you $laurenelixabeth! #CashAppForHotties",0.597014925373134,0.402985074626866,"Positive"
"3025","About seven of every 10 college students support a required COVID-19 vaccine for in-person classes ",1,0,"Positive"
"3026","contdTo say that vaccine required to attend X university or work at Y hospital... is abject violation of basic human rights... flies in the face of the social contract, as well as settled American jurisprudence.Proximally, one is free to attend different college.continues/",0.627777777777778,0.372222222222222,"Positive"
"3027","Id happily take 150, but Id rather get a vaccine and a guarantee of going back to college in-person than just a vaccine and 150 sitting in the bank. ",1,0,"Positive"
"3028","The University of Utah is taking on the COVID-19 College Vaccine Challenge. And we are going to need the help of every member of the campus community to make it a success.",1,0,"Positive"
"3029"," Kathleen I happen to believe it is reckless behavior to not accept the vaccine. I also believe parents can intervene when college aged kids are acting stupidly. You have seen the beast close up. Are you relying on serendipity for this pandemic to end?",0,1,"Negative"
"3030","Get the safe and free #COVID19 vaccine and you can be eligible to win $1M or a college scholarship. You can register starting TOMORROW! Learn more about the Massachusetts #VaxMillions Giveaway: ",1,0,"Positive"
"3031","Why are Catholic colleges like  expelling pro-life students for rejecting the dead baby vaccine?Via John Zmirak#COVIDvaccine #Catholic #conscience #abortion",0.201327433628319,0.798672566371681,"Negative"
"3032"," Hello, could you please advise which vaccine will be given on July 2nd for first dose at Seneca college location? Can I do walk in? Thanks!",1,0,"Positive"
"3033","  I wish ALL colleges and universities would mandate the vaccine. That would end all the discussion!Vaccinate go to college in person-dont vaccinate take all of your classes online. period.",1,0,"Positive"
"3034","Writing to Gov. Ron DeSantis (R-FL) and FSU President John Thrasher, Sabatini said students in the College of Music are being forced to show proof of vaccination before the Fall semester begins in violation of Florida law.  #covidhandcuffs",0,1,"Negative"
"3035","The CDC recommended that pregnant women receive the COVID-19 vaccine. If youre still unsure about getting the vaccine, your doctor can help you decide whats best for you and your baby. Get more updates from the CDC or the American College of Obstetricians and Gynecologists. ",0.811594202898551,0.188405797101449,"Positive"
"3036","* A teen from #NassauCounty was among 10 to win a full ride to any SUNY or CUNY school after getting a COVID-19 vaccine. #DailyVoice ",1,0,"Positive"
"3037","* A teen from #LongIsland was among 10 to win a full ride to any SUNY or CUNY school after getting a COVID-19 vaccine. #DailyVoice ",1,0,"Positive"
"3038","College Students Suing Over State Universities Vaccine Mandates  Truth Unmuted ",0.522598870056497,0.477401129943503,"Positive"
"3039","Congratulations to Year 10 Debating Team of Cara, Reefe, William, Grace &amp; Georgina on winning the Burnley College Debating Competition fighting off excellent competition from CRGS, West Craven &amp; Mount Carmel on the subjects of vaccine passports, civil liberties &amp; much more. ",0.872521246458924,0.127478753541076,"Positive"
"3040","All students who have uploaded their vaccine status to CoVerified OR have obtained a waiver from the College by August 1st will be entered into a lottery to win FREE BOOKS for the Fall 2021 semester.  ",1,0,"Positive"
"3041","The last round of winners of college scholarships in the states GetA Shot to Make Your FutureCOVID vaccine incentive was announced Wednesday.  ",1,0,"Positive"
"3042","The ACP recognized that special efforts may be needed to deliver #COVID19vaccines to the marginalized and underserved populations to promote equity. #ClinicalPain ",1,0,"Positive"
"3043","#COVID19 vaccinations available at #Calderdale College tomorrow - no appointment needed.  9:30am-4pm Pfizer vaccine, first and second doses (if 8 weeks since your first)For more details visit ",0,1,"Negative"
"3044","19-Year-Old College Freshman Dies From Heart Problem One Month After Second Dose of Moderna Vaccine  Childrens Health Defense HOW SAD ",0.186915887850467,0.813084112149533,"Negative"
"3045","Ready to #TakeyourSHOT at free college? Anyone who has received at least one dose of the vaccine can register to win prizes and cash! Dont miss your #Shotatamillion! Get vaccine information TODAY by visiting ",1,0,"Positive"
"3046","  What polls ?  My childs college doesnt require the shot. Most people ???  Is that 1 of those liberal polls. A vaccine, not FDA approved and like a subservient sheep , you ask no questions.",0.312820512820513,0.687179487179487,"Negative"
"3047","A Cayuga County student is one of the final winners of a full scholarship to a public college or university in New York  an incentive offered by the state to get more children ages 12-17 vaccinated. ",1,0,"Positive"
"3048","Stay safe, get vaccinated! El Camino College is hosting a one-day #COVID19 vaccination clinic next week on July 7. The event will be run by Providence, is open to the public, and free of charge! Appointments &amp; walk-ins are welcome. More info: ",1,0,"Positive"
"3049"," You seem to be under the impression that people who dont have the vaccine are staying home, or are going out with a mask. This is not the case.",1,0,"Positive"
"3050","So the cuban vaccine is actually STILL ON TRIALS and guess who theyre going to use to test them? Venezuelans.The president of the Caracas Nurse College rejects the use of a trial vaccine in the mass (if it can even be called that) distribution program. ",0,1,"Negative"
"3051"," Column: Can college football help COVID vaccine division? - Los Angeles Times  ",1,0,"Positive"
"3052","We are doing this for every student, faculty and staff member at the College. JCCC is taking the pledge and committing to action. Get the COVID-19 vaccine. Learn more: ",1,0,"Positive"
"3053","FRANKFORT, Ky. (KT)  Wednesday at 11:59 p.m. eastern time is the deadline to register for the first drawing for $1 million or a full college scholarship as part of Gov. Andy Beshears COVID-19 vaccine incentive program. ",1,0,"Positive"
"3054","I agree that football can help in getting people vaccinated. Mandate digital vaccine passport for attending any school or college football games. Incentives will not work on many people. Why should the vaccinated be punished by exposure to unvaccinated. w/.",0.712389380530973,0.287610619469027,"Positive"
"3055","    In Karnataka just to start college and collect fees Karnataka govt prioritising Vaccine for college students and made others to wait I request you to cancel prioritization I request all citizen go to place where they giving vaccine.",0.547169811320755,0.452830188679245,"Positive"
"3056","Its Crazy How They Forcing College Kids To Get The Vaccine In Order To Go To School",0,1,"Negative"
"3057","  every single vaccine that youve had in your lifetime every single one has had the chance to kill you. Like all of them. People react negatively to certain things in certain vaccines which is why you do research.  meningitis shot that you have to get before college can kill you",0.480836236933798,0.519163763066202,"Negative"
"3058"," Sahi hai! Ye hi hoga ab!Vaccine diplomacy, BC!Every country should just accept every freaking vaccinated person.Have heard of peoples travel plans &amp; accepted college admissions get cancelled due to vaccine selection!",0.442028985507246,0.557971014492754,"Negative"
