"","text","positive","negative","assigned"
"2024","   2 of 2 in the past was subject to vaccine passport (yellow fever), mandatory  vaccination (hep B) &amp; had family member required to disclose vaccine status prior to study at US college. No problem with those. Entirely acceptable.",1,0,"Positive"
"2025"," Dear sir. I had booked a slot for Covid vaccination in Mesco College of pharmacy Hyderabad but did not take vaccine. But I got certificate saying 1st dose received. My vaccine is due on 28 June. Please help me ",1,0,"Positive"
"2026","Pradhan mantriji  vaccine College students immediately. No more time to waste, its a humble request. #NoExamUntilVaccination",0,1,"Negative"
"2027","The political/culture wars over vaccination mandates at colleges and univs in 16 GOP states = a disaster this fall as students return, low vax rates, the Delta variant dominant, winter drives people indoors.   ",0,1,"Negative"
"2028","Whats most disconcerting about the vaccine scam in Kolkata is that until  complained, none had complained about not receiving their certificates. Saw a college student say on TV that he took Sputnik V at the camp(when it is only being piloted in select hospitals)",0.258620689655172,0.741379310344828,"Negative"
"2029"," Today womens college Jaleswar vaccine not available .why reply plz",1,0,"Positive"
"2030","I got my Jab -SPUTNIK v- vaccine at 8.11 a.m today. We were requested to be present at 8 a.m by the Grama niladharini ,St Sylvesters college Kandy .Very well organized  pleasant Ceremony. Hundreds  of people , but highly disciplined. ",1,0,"Positive"
"2031","im so glad i had my vaccine at the end of the week rather than the beginning because of college",1,0,"Positive"
"2032","       Honble Minister Sir today Citizens came for vaccination as per the CMO Cachar order at TT College, from 4AM &amp; was sad as they had 2 return back without vaccine in this hottest day ",0,1,"Negative"
"2033","13...first COVID-19 vaccine dose,for a chance to win one of 50, four-year full-ride scholarships (including tuition, fees, room-and-board, and expenses) to any New York State public college or university.",1,0,"Positive"
"2034","18 or older and not had your first COVID vaccine dose? #GrabAJab today! The Moderna vaccine is waiting for you at  10am-4pm (last admissions 3.30pm) No need to book, just walk in!Bring photo ID to prove your age!    ",0,1,"Negative"
"2035"," College should be re-opened only after giving two doses of vaccine. Only than students will be termed as Vaccinated not after just one dose.   ",1,0,"Positive"
"2036","Who wouldve thought the most exciting thing of my 1st year college life would be getting a freaking vaccine.",0.555555555555555,0.444444444444444,"Positive"
"2037","Though  ,cowin portal said 18+ can take free vaccine by visiting nearest center. Yesterday,I visited nearest center,they asked me to get permission from health inspector,who also didnt allowed despite showing offer letter from my college.  ",1,0,"Positive"
"2038","Research Combating Vaccine Hesitancy with Vaccine-Preventable Disease Familiarization: An Interview and Curriculum Intervention for College Students by Prof. Dr. Brian D. Poole et al.  #vaccines ",0,1,"Negative"
"2039","Trinity College at University of Cambridge hopes to fund projects to help identify and respond to emerging diseases that could become the next pandemic.Former Chief Medical Officer for England, Dame Sally Davies explains the Trinity Challenge.More: ",1,0,"Positive"
"2040"," Hialeah  Tuesday, June 29Miami Dade College Clinic1780 W 49th St, Room 5101 Hialeah, FL 9 a.m. - 5 p.m.Pfizer Vaccine (Pfizer approved for ages 12 - 17 &amp; must be accompanied by a parent or guardian)Call to schedule appointment or walk-ins are also welcomed.#Hialeah ",1,0,"Positive"
"2041","So you have a 18 year old going to college and many colleges are demanding the vaccine. What do you do? ",0,1,"Negative"
"2042","  How about all college students must reveal their political affiliations. How about ordering cruise lines, over which Florida has no control, to drop vaccine and mask rules. How about the touchy feely test to ensure that students are not transgender.",0.376623376623377,0.623376623376623,"Negative"
"2043","         #Reopencolleges #reopenkotacoaching #reopencollege PLEASE OPEN COLLEGE INSTITUTE WITH #VACCINE_CERTIFICATE.        ",1,0,"Positive"
"2044","#reopencollege #Reopencolleges PLEASE OPEN COLLEGE WITH VACCINE CERTIFICATE.       ",1,0,"Positive"
"2045","i have yet to get my vaccine and the deadline for my college is the 9th of august, i need to be fully vaccinated by then and yet my parents are fucking pussies bc they think the vaccine will kill me or something",0,1,"Negative"
"2046","  Sir, a sincere request. Ask businesses and especially educational institutions to vaccinate their staff. College authorities are asking staff to attend work but not providing us with basic need like vaccine. Kindly issue a directive.  ",1,0,"Positive"
"2047","Public standing in Line for Vaccination at JNRM COLLEGE reached to Macchi Line Road.People are now aware &amp; taking Vaccine. ",1,0,"Positive"
"2048","   #reopencollege PLEASE OPEN COLLEGE INSTITUTE WITH VACCINE CERTIFICATE.       ",1,0,"Positive"
"2049"," could you please advise which vaccine will be at Seneca College Newnham Campus appointments tomorrow (june 25). thank you!",1,0,"Positive"
"2050","  Jhuthelal modi hr college aur university me thank you modi for free vaccine wala farzi poster lgwa rha",1,0,"Positive"
"2051","Ay, oh, way to go, Ohio. With the recent SCOTUS ruling, red states are slipping no-trans clauses into their bills allowing college athletes to profit from playing &amp; fast tracking them.",1,0,"Positive"
"2052","   The communal living environment of college campuses most definitely requires vaccine mandates. Thats why most require a slew of vaccines including meningitis. Many have behavioral mandates also. If you dont like them, you are free to go elsewhere.",0.747368421052631,0.252631578947368,"Positive"
"2053"," Thank you! You make Imperial College of Med proud. On an another note, perhaps we could encourage the conspiracy theorists, to get the vaccine- yes, the vaccine builds up in the ovaries and makes you develop all these anti-vaxxer follicles and embryos to populate the world!",0.782287822878229,0.217712177121771,"Positive"
"2054","   Amber, is congenital condition one which would put at increased risk from vaccine but not severe covid symptoms? Based on how mRNA works, those who would suffer issues with it are unlikely to do well with covid.  Does doc recommend college w/o vaccine? Note stats above for 12-17.",0.627659574468085,0.372340425531915,"Positive"
"2055","The GOP is now the flat Earth, anti-vaxx, conspiracy party. What a long fall from the party of Lincoln. ",0.614084507042254,0.385915492957747,"Positive"
"2056","  How many college students are we condemning to death by forcing an experimental vaccine on them?  How many deaths will it take until the CDC changes its recommendations or people start asking questions and maybe using common sense. 99.9% recovery for this age group.",0,1,"Negative"
"2057"," Congrats!  My daughter graduated high school this year as well.   What a crazy time the end of high school has been for them.  Im thankful for the vaccine and hopefully a normal freshman year at college.  Our kids need that.",0.836805555555556,0.163194444444444,"Positive"
"2058","I graduated college and high school and Pinnacle Bank Arena, got my first dose of the vaccine during the pandemic at Pinnacle Bank Arena, and now Im seeing Styx live at Pinnacle. Im ready to die now",0.38961038961039,0.61038961038961,"Negative"
"2059","At This Rural College, Covid Vaccine Hesitancy Is High. The President Is Mandating Shots Anyway. ",0,1,"Negative"
"2060","The political/culture wars over vaccination mandates at colleges and univs in 16 GOP states = a disaster this fall as students return, low vax rates, the Delta variant dominant, winter drives people indoors. ",0,1,"Negative"
"2061","  Terrible timing, right before meeting confirming a likely connection to myocarditis and the vaccine, specifically for college aged students.  What about students who already had Covid and have natural immunity.",0.444444444444444,0.555555555555556,"Negative"
"2062","#Reopencolleges PLEASE OPEN COLLEGE INSTITUTE WITH VACCINE CERTIFICATE AND MASK.        ",1,0,"Positive"
"2063","  450 Japanese doctors and Mr. Nori Takahashi who Professor Emeritus of Wisconsin Medical College of USAthey submitted a petition to the Ministry of Health, Labor and Welfare to stop vaccination under joint names.and have reported that at least 356 people have died after vaccine",0,1,"Negative"
"2064","me: literally trying to figure out what type of insurance i have for my vaccinemom: idk youre a college grad figure it out ",0,1,"Negative"
"2065","  When will Excelsior Pass be available for residents of NY that received their vaccine in a different state (college students)? Thank you!",1,0,"Positive"
"2066","what covid vaccine should i get, college is forcing students to get one and i really dont want to stay home tbh ",0,1,"Negative"
"2067","&gt; According to Vice, sperm is not a low-demand and high supply market. Those looking to make babies in vitro really do want the highest quality semen available: college educated sperm that is free of disease and physical abnormalities. ",1,0,"Positive"
"2068","Hey let them go unvaccinated. And when they get sick &amp; disabled, administration can refuse re-admittance based on if theyre too STUPID to take the vaccine, theyre not college material. Students Sue University Over COVID Vaccine Mandate ",0,1,"Negative"
"2069","A friends old college roommate died from covid today. He was only admitted to the hospital on Monday. He was hesitant about getting the vaccine ",0.446153846153846,0.553846153846154,"Negative"
"2070","  My son has a congenital condition. I spoke with his specialist who he has seen since he was born. We choose not to get the Covid vaccine. His college is mandating the vaccine. This is a problem.",0,1,"Negative"
"2071","From free Panera bagels and Chipotle burritos to delivery service gift cards for college students, these incentives come days after the White House acknowledged the US would fall short of President Joe Bidens July Fourth Covid-19 vaccination goals ",1,0,"Positive"
"2072","F*ck you college for forcing me to take the vaccine when it isnt even 100% approved yet",0,1,"Negative"
"2073"," I think the vaccine will be mandatory for school kids. anti vaccine parents are probably going to have to home school eventually. NY already requires the vaccine for college students and employees.",0.365384615384615,0.634615384615385,"Negative"
"2074","Mandatory vaccine if you want to attend college in a Connecticut university. Hows that for my body, my choice?",1,0,"Positive"
"2075","The inimitable Ive Jones- who just finished her freshman year of college!- introduces the president here in Raleigh as he kicks off a vaccination canvass event. To get the vaccine is to honor you, your community, and to honor the gift of another day. Well said, Ive. ",1,0,"Positive"
"2076"," Is the vaccine store now closed? Who does our tax dollars go to every damn thing except the things WE need. Universal college and healthcare PLEASE!",0.551546391752577,0.448453608247423,"Positive"
"2077","From bagels to burritos, White House announces new incentives to boost youth vaccination rates....From free Panera bagels and Chipotle burritos to delivery service gift cards for college students",1,0,"Positive"
"2078","Montgomery County will suspend COVID-19 vaccinations at the Montgomery County College site in Germantown, Maryland, on July 2. ",0,1,"Negative"
"2079","The #COVID19 vaccine is now recommended in pregnancy by the CDC, the American College of Obstetrics and Gynecologists as well as the Society for Maternal Fetal Medicine - Dr. Massey explains. ",1,0,"Positive"
"2080"," Under Fuhrer DeSantis you cant ask anyone about their vaccine status, but demanding to know college students political affiliation is a-ok. #DeathSantis  has to go.",0,1,"Negative"
"2081","My college just announced a vaccine mandate!Am I going maskless? Not sure yet; I guess well see where the numbers go. But at least theres a chance!!",0.767772511848341,0.232227488151659,"Positive"
"2082"," please continue to fight for our covid recovered college children who are unvaccinated and being forced to wear a mask. CDC needs to be pressured to recognize natural immunity as at least equal to vaccine immunity. What are they waiting on.",0.389558232931727,0.610441767068273,"Negative"
"2083","A study analyzing whether the COVID-19 vaccine prevents infection and spread of the coronavirus among college students has been expanded to include adults ages 18-29, including those who choose not to get vaccinated.",1,0,"Positive"
"2084","And do ppl (esp. docs) not c a difference b/w acquiring COVID naturally and having a complication vs. complications arising from a state/college/society mandate for healthy citizens to get a vaccine ?moral calculus &gt;&gt; utilitarian calculus#trolleyology",1,0,"Positive"
"2085","Just received an offer to get vaccinated... in Belgium! Which I turned down and then booked my NI vaccine. The fact that international college students are now being offered the vaccine in Belgium is a good sign for the progress of the campaign.",1,0,"Positive"
"2086","WH announces new incentives to boost youth vaccination rates. From free Panera bagels / Chipotle burritos to delivery service gift cards for college students, the incentives come days after the WH acknowledged the US would fall short of Bidens July 4th...",1,0,"Positive"
"2087","Haha bravo  for (attempting) to ask the right Qs about Bethany College now mandating vaccine for students. Bethany College will honor immunization exemptions for medical, religious, and philosophical reasonsThe release also did not specify what...",1,0,"Positive"
"2088","The latest news from around higher ed: New Jersey leaders agree to free college expansion.  blocks an Ed Dept nominee. Pennsylvania lawmakers eye ban on vaccine requirements.",0.513677811550152,0.486322188449848,"Positive"
"2089","Florida State University has claimed that they accidentally demanded students at the College of Music take the COVID vaccine in contrary to state law, after  threatened to put them in their place ",0,1,"Negative"
"2090","Based on the information given after taking the jab, evidence of taking the vaccine holds the keys to so many things. Employers will ask for vaccine certificate, you cant travel out of the country nor will you be able to attend college. I wished Nigeria could go this tough. ",0,1,"Negative"
"2091","The White House announced new incentives to boost youth vaccination rates including: Panera bagels , Chipotle burritos , GoPuff credits for college students and a Relax While You Get Vaxxed meditation on the app, Shine.",1,0,"Positive"
"2092","Only a matter of time before some #Republican state legislature blocks its colleges basketball coaches from playing zone defense: ",0.699324324324324,0.300675675675676,"Positive"
"2093","How College Students Can Say .No! to a Mandatory Vaccine - ",0.343434343434343,0.656565656565657,"Negative"
"2094","Dont forget! We have a 2nd Dose Pfizer COVID-19 Vaccine Clinic happening today from 1:30 pm-5:00 pm at the PSJA Dr. Daniel King College &amp; University Center in San Juan! ",1,0,"Positive"
"2095","Desantis in Florida is against cruise ships requesting vaccine info; but he favors getting voter info of all college kids in Florida?   Florida is so fuing corrupt.",1,0,"Positive"
"2096","With 111,000+ doses administered by  at our City College vax site, we have made great strides in getting SF to 81% first doses. Max vax sites like these made what was once impossible, possible. Read about how we are re-focusing our vax efforts here: ",1,0,"Positive"
"2097"," InsaneNo reason a healthy college kid needs a vaccine for an illness with a 99.9% survival rate",0.5,0.5,"Negative"
"2098","In the last month (esp last 11 days)  Ive: - completed my final year thesis and gotten final approval- gotten final cgpa (btech/grad)- gotten the first dose vaccine- started first job :) - had multiple serious coming out conversations w parents- completed college PoR",0.823529411764706,0.176470588235294,"Positive"
"2099","SOUND OFF: All students at Connecticut State Colleges and Universities are required to be vaccinated before fall semester, officials announced Thursday.We want to hear from you. Do you think the COVID-19 vaccine should be required for college kids? Reply &amp; let us know! #share61 ",1,0,"Positive"
"2100","  I wore a mask when I had to. The ban is lifted so now I dont have to. If you do, even better .The vaccine has too many unknowns for young adults to be required to return to colleges or college sports.",0.445255474452555,0.554744525547445,"Negative"
"2101"," Students SHOULD be up in arms! Most of them had covid. Cleveland clinic just released a study that proves for anyone that had covid, you do not benefit from this vaccine. College athletes are having heart attacks after their 2nd dose. NOT SAFE.",0,1,"Negative"
"2102"," Right, such an insult to have a vaccine passport but I want to know how you vote to go to college in Fla. and Im gonna charge the cruise ships 5000.00 per person if they ask for proof of vaccine.  Gop are such hypocrites..",0.402597402597403,0.597402597402597,"Negative"
"2103"," Yes you can, Im an international student and the college/medical insurance were assigned provided us with the vaccine free of cost.",1,0,"Positive"
"2104","I feel awful for the college students who have been blackmailed into taking the vaccine",0,1,"Negative"
"2105","  Basically youre saying in order to become successful and get a college degree, you are going to be forced to take a vaccine even though you dont want it thats discrimination.",0.474654377880184,0.525345622119816,"Negative"
"2106"," #reopenkotacoaching #Reopencolleges PLEASE OPEN COLLEGE INSTITUTE WITH VACCINE CERTIFICATE AND MASK.     ",1,0,"Positive"
"2107","   I know way too many people, with college degrees and above, that are not taking the vaccine.  Its not lack of education.  The answer is the FDA hasn\t technically approved it.  When they do, I will get the shot.",1,0,"Positive"
"2108","Mandating the vaccine for college students.. well so much for me going back to school smh",0.476987447698745,0.523012552301255,"Negative"
"2109","People who havent received COVIN shots are too dumb to be admitted to college. There is no excuse for not getting the vaccine unless you have some medical issues supported by your doctors and medical history, failure to get the shots is criminal.",0.247386759581882,0.752613240418119,"Negative"
"2110"," We have to understand theres difference b/w college and school students and their studies college students are 18+ and can take up the vaccine r mature to follow sop and also require more of physical classes than school students so college should be reopened now atleast",1,0,"Positive"
"2111"," We have to understand theres difference b/w clg and school students..and their studies..clg students are 18+..and can take up the vaccine..r mature to follow sop and also require more of physical classes..than school students..so college should be reopened now atleast",1,0,"Positive"
"2112"," We have to understand theres difference b/w clg and school students..and their studies..clg students are 18+ and can take up the vaccine r mature to follow sop and also require more of physical classes..than school students so college should be reopened now atleast",1,0,"Positive"
"2113","Landmark College is taking the pledge and committing to action. Get the COVID-19 vaccine. #WeCanDoThis #COVIDCollegeChallenge ",1,0,"Positive"
"2114"," Any vaccine mandates should be banned. How is it legal to force you to choose between a job or college and possible permanent health related issues. The more the vaccine is given, the more we learn about the risks. As we tends to do when there are years of research vs weeks",0.230769230769231,0.769230769230769,"Negative"
"2115","We have to understand theres difference b/w clg and school students..and their studies..clg students are 18+..and can take up the vaccine..r mature to follow sop and also require more of physical classes..than school students..so college should be reopened now atleast",1,0,"Positive"
"2116"," Keep the schools close..of therefore concern..but please let the college reopen for higher studies   ..we all are 18+..and have taken the vaccine..or will take..and can even take precautions..but plz let the college reopen atleast..",1,0,"Positive"
"2117","A free vaccine clinic will be held at the Riverside City College Digital Library Auditorium on Monday, June 28 from 9am-5pm.Vaccines are safe and effective. Do your part to protect yourself and your community. To make an appointment, visit: ",1,0,"Positive"
"2118"," #reopenkotacoaching #Reopencolleges PLEASE OPEN COLLEGE INSTITUTE WITH VACCINE CERTIFICATE AND MASK ",1,0,"Positive"
"2119"," I AM A 72 YEAR OLD WIDOW---and DESPERATE to get into USA on Wednesday--have vaccine  certificate-ESTA and covid tests ordered before I fly- I am raising college funds for my two God Children 8 and 5 whoes daddy died in January .  pat123pat.com PLEASE CAN YOU HELP .",0.56420233463035,0.43579766536965,"Positive"
"2120","Hey, college students planning not to get vaccinated: IF YOU DRINK ALCOHOL AND EAT FAST FOOD, YOU ARE NOT ALL THAT CAREFUL ABOUT WHAT YOU PUT IN YOUR BODY  ",0,1,"Negative"
"2121","There is no upside to giving teenagers and college students Covid vaccine. Only downside. Please stop doing this to your children.. also please dont use in women of childbearing age or if pregnant or could become pregnant. ",0.52317880794702,0.47682119205298,"Positive"
"2122"," #SHARE: #JACKSONVILLE Community Covid Vaccine Event.Friday, June 25 - 3 PM - 6 PM .Location: Coastal Carolina Community College, 444 Western Blvd Jacksonville NC 28546.Walk Ups Welcome.For more info: ",1,0,"Positive"
"2123"," Mumps breakout a couple of years ago. Nobody died yet college kids screaming at people to get the mumps vaccine.",0,1,"Negative"
"2124","  My kid got meningitis 5 months into her first yr of college.I had lied and told her vaccine was MANDATORY (NCAA rules)That shot changed the outcome for the better!Tried and true vaccines are necessary to protect us, Vaccines created in a hurry with NO LONG TERM STUDYSCARY!",0.644444444444444,0.355555555555556,"Positive"
"2125","Do you want a 1-Day ticket to #Lolla and access to a special Lolla show at House of Blues for free? Make sure to get your COVID-19 vaccine on #LollaDay this Saturday 6/26 at Malcolm X College! Sign up at ",1,0,"Positive"
"2126"," This college doesnt want to be a part of any love and support to all people on campus, they refuse the masks refuse the vaccine even after one almost died. Their whole demeanor creates havoc on those young minds trying to stand up &amp; saying we all matter.",0.43956043956044,0.56043956043956,"Negative"
"2127","One thinks I dont understand . its ok that most of 12th class  students are may be 16-17 years ,I agree but most of college students are also still 17 year old .That means they are also not eligible for taking vaccine.who will think the issue of poor student #promotehpustudent",0.453237410071942,0.546762589928057,"Negative"
"2128","The Republican Party, 2021: Trump is infallible and vaccines that help to open businesses and schools are oppressive. Can always count on the Grand Old Party to defend Americas interests. ",0.828715365239295,0.171284634760705,"Positive"
"2129","Now a Canadian is doctor fired for voicing safety concerns about Covid  vaccine for childrenShocking  ",0.436363636363636,0.563636363636364,"Negative"
"2130"," But sir karnataka govt said yesterday that colleges will re open by vaccinating college students and teachers.Few of us are against the vaccine but now we will b forced to vaccinate unwillingly.",0,1,"Negative"
"2131"," Various scenarios: colleges/universities in Ontario have indicated mandatory in order to attend residence (Western, Ryerson, ?Seneca College); overlapping messages re travel, quarantine, and vaccine status; some workplaces. ?Legality #cpso",1,0,"Positive"
"2132"," Ive been following your J&amp;J discussion as I had my 18-year-old son vaccinated with it nearly 12 weeks ago. Im wondering if he should get a mRNA booster before he goes to college? Worried about his risk all the time since I got this vaccine.",0,1,"Negative"
"2133"," Forcing was in quotes that indicates it isn\t gun to your head forced but you already knew this. You know what I meant by forced. Vaccine passports to participate in society. No vaccine no service, no vaccine no college education, no vaccine no employment etc",0.547854785478548,0.452145214521452,"Positive"
"2134","Tucker about how college kids feel pressure to take the vaccine ",0,1,"Negative"
"2135","The mask fight was stupid. And now the fight over requiring vaccines is even dumber. #factsmatter #Science ",0,1,"Negative"
"2136","   Employers should be allowed to decide what is best for their business. You have the choice not to get the vaccine. The employer has the right to have you work there. What is the big deal having proof of vaccine?  People have to have it for their children for school and college.",1,0,"Positive"
"2137","Vaccination centers for 18-44 age group: 1. Mumtaz College Akberbagh (Saidabad) - Pin: 500059Vaccine: COVISHIELD. Cost: Free Total 190 slots are available on Jun 26 (Dose1: 190, Dose2: 0) CoWin: ",1,0,"Positive"
"2138","Vaccination centers for 18-44 age group: 1. Mumtaz Degree P.G. College (Saidabad) - Pin: 500059Vaccine: COVISHIELD. Cost: Free Total 196 slots are available on Jun 26 (Dose1: 196, Dose2: 0) CoWin: ",1,0,"Positive"
