"","text","positive","negative","assigned"
"1012","Weve heard that false information about the COVID-19 vaccine has made some women hesitant about getting the jab.The Royal College of Midwives and The Royal College of Obstetricians and Gynaecologists say that there is no evidence to suggest this. #CovidVaccine ",0,1,"Negative"
"1013"," A good college class might have warned you about the post hoc fallacy. Dying after having the vaccine does not mean the vaccine caused the death. Ex. unemployment # fell after P-45 was elected. He took credit, but fact is they were simply continuing the fall BHO policies started.",0.387640449438202,0.612359550561798,"Negative"
"1014","Sending your son to college? Is the vaccine risk worth it? ",0.43558282208589,0.564417177914111,"Negative"
"1015"," Please please can we get 17 year olds vaccinated. My child is in a 6th form mixing with 18 year olds in tutor groups indoors.They are travelling to college by train and into a Delta variant hotspot. Please can they get protected now. They only miss out on the vaccine by 6months",0.859375,0.140625,"Positive"
"1016","Massachusetts Announces $1M VaxMillions COVID Vaccine Lottery; If Youre Not Vaccinated, You Cant Play  ",0,1,"Negative"
"1017","More re: college vaccine mandates liability? ",0,1,"Negative"
"1018","Today on the Rundown w/ :North Korea defector - Yeonmi Park says whats happening in our schools is worse than a dictatorship! College students are being FORCED to get the vaccine.  joined the show.Full Show: ",0,1,"Negative"
"1019","Arizona Governor Doug Ducey announced on Tuesday an executive order that will prevent the states public colleges and universities from mandating the COVID-19 vaccine for its students....",1,0,"Positive"
"1020","  No, because you would apply for an accommodation due to an inability to take the vaccine. That exists in other places where vaccination is required (college dorms for instance).",0,1,"Negative"
"1021","Fake news is not covering this sad death of a beautiful college student when she was forced to take the vaccine (moderna) in order to stay at college",0.393285371702638,0.606714628297362,"Negative"
"1022"," And taking the vaccine should be a choice Just because people are to lazy to protect themselves doesnt mean thevresy should be responsible for it just like college loam forgiveness just because people make bad life choices doesnt mean the rest",0.611295681063123,0.388704318936877,"Positive"
"1023","Got vaccinated by flu vaccine. Its my first time so it hurts a lil but I can endure the pain. Sanay to sa sakit!! Major ko ata yun sa college HAHAHSSH",0,1,"Negative"
"1024","  immunized in the mid-1980s, might only have received a single MMR vaccine. A single dose provides protection but is less effective than two doses. College students are among the groups the Centers for Disease Control and Prevention categorizes as high-risk",1,0,"Positive"
"1025","Baseball fans who havent yet tracked down a #COVID vaccine are in luck: The Douglas County Health Department will host a clinic throughout opening weekend of the College World Series. Read more here from :",1,0,"Positive"
"1026","Mass VaxMillions vaccine lottery giveaway includes 5 $1M winners; 5 college scholarships. Would you do it or nah? ",0.689497716894977,0.310502283105023,"Positive"
"1027","   Liking his own tweet where he owned himself. He claimed no such thing as measles vaccine required for college. Yet in 28 states you have to get it. Hes utterly wrong, and when the proof was shoved in his face, he accused others of not reading it.",0.259067357512953,0.740932642487047,"Negative"
"1028","   Yeah, I do, but you obviously dont. 22/50 = less than half, genius. Your exact words: Measles vaccine required for college doesnt exist.Yeah, it does. You lose. Again. You dont know shit about anything.",0.606334841628959,0.393665158371041,"Positive"
"1029","The Lottery Society: The college-for-vaccine sweepstakes is like a plot point in a dystopian sci-fi satire  only its real. ",1,0,"Positive"
"1030","   Not sure what century you live in. Measles vaccine required for college doesnt exist",0,1,"Negative"
"1031","Concerned about getting #Covid vaccine slot? Abhishek V Ashok, a BSc Computer Applications student at SH College, Thevara, has developed an android app, which alerts users when an empty slot is available via  #Kochi ",0,1,"Negative"
"1032","    Hur de due. The phucking college that made an experimental vaccine mandatory. Have you ever heard of the Nuremberg trials? Is there something wrong with you?",0.275,0.725,"Negative"
"1033","  Hello Jacobs Well is suitable for ages 40 plus, and Bradford College can vaccinate those 18 plus.  can confirm and vaccine information.",1,0,"Positive"
"1034","Vaccination slot available On:  - Date: 16-06-2021 - For Age(+): 18 - Slot Available: 50 - Vaccine : COVISHIELDIn P.D. PANDYA COLLEGE, NA-, Ahmedabad Corporation, Gujarat, 380050 Fee: Free #COVID19 #Vaccine #CovidIndia #vaccination #Cowin #India",1,0,"Positive"
"1035","  You should drop out of college if you wont get the vaccine. Simple. Problem solved.",0.305475504322767,0.694524495677234,"Negative"
"1036","Yesterday at college we were presented with this fancy sleek presentation and were shown a 25 minute video calling us heroes and pioneers for following the rules and we cod save millions of lives by taking this vaccine and we would be heroes in our community",1,0,"Positive"
"1037","#Appreciationpost: THRiVE is incredibly proud of Dr Edward Wampande, its #postdoc researcher at  &amp; head of the colleges diagnostic &amp; research lab. He is performing experimentation on small lab animals 2 test potential vaccine &amp; diagnostic candidates 4 a host of zoonoses ",1,0,"Positive"
"1038","U.S. College COVID Vaccine Mandates Dont Consider Immunity or Pregnancy, and May Run Foul of the Law &gt; same in the UK?",1,0,"Positive"
"1039","Government invite under 21sfor jabs&gt;19-Year-Old College Freshman Dies From Heart Problem One Month After Second Dose of Moderna Vaccine ",0.371287128712871,0.628712871287129,"Negative"
"1040","    Nice arrangement by the administration in jajpur biraja womens college I have today received my vaccine",1,0,"Positive"
"1041","  You mean be prepared for those waitlist students to get their chance to attend.No ones crying for those who refuse college because of a vaccine.",0.423728813559322,0.576271186440678,"Negative"
"1042","Just because I love to do lists so much! College course for the dayDrop off books for ZiffitVaccine appointmentBuddy read section of This LieTake IG photo of RabbitsFinish RabbitsSprints on my channel!",1,0,"Positive"
"1043"," dont act like an educated fool Mr  Karnataka has reportedly failed in administering vaccine for 18+ and college-going students. first, your objective should be vaccination on a mass scale rather than making Karnataka an educational hub. Please look into that first",0.215596330275229,0.784403669724771,"Negative"
"1044","19-Year-Old College Freshman Dies From Heart Problem One Month After Second Dose of Moderna V@!ne",0,1,"Negative"
"1045","..21yr old Student Who Developed Myocarditis After 2nd Moderna Shot: A NJ student whose college, the New Jersey Institute of Technology, requires all students to be fully vaccinated, became ill within hrs of receiving 2nd dose of Modernas COVID vac",0,1,"Negative"
"1046"," Thats why illiterate like you shouldnt enter Your  in biology.1st : to test every Vaccine BSA ( bovine serum albumin ) needed. Its a made from cow but synthetic now . It doesnt need to killed cow /calf ok. They just push injection &amp; take 2-5 ml of bloodGo &amp; join college",1,0,"Positive"
"1047","To       Honble cm           To day in dharmapuri covid 19 camp conducted at govt arts college  nearly 500 token used  I had injected covi shield since I am  aged  73 years old thank the honble cm for sending of  vaccine Valga valamudan",1,0,"Positive"
"1048","   But *we* are concerned about safety too. The numbers youre worried about (226 college students with bad vaccine reactions) have no moral standing against numbers like 600,000-900,000( based on NPRs reporting) COVID deaths in the span of a year.",0.401812688821752,0.598187311178248,"Negative"
"1049","These students remain free to transfer to a school that doesn\t require a vaccine or charge a premium to those who don\t get vaccinated. Why should a student be free to choose not to be vaxed but an institution not free to require vaccination to attend?",0.548387096774194,0.451612903225806,"Positive"
"1050","     They are free to not have the vaccine. Then they have health checks and wear masks. Or they are free to do courses online, go to another college, or not attend college at all.",1,0,"Positive"
"1051","Oh dear- how horrible 19-Year-Old College Freshman Dies From Heart Problem One Month After Second Dose of Moderna Vaccine ",0.295774647887324,0.704225352112676,"Negative"
"1052","#VaccinationForAll #VaccineForAll Ek naya siyyapa face kar raha hoon. Standing outside GSVM medical college vaccination center for 2nd dose of Covaxin with family wife and both brother. Staff here refused to give vaccine until count become 10. No value for other time.",0,1,"Negative"
"1053","  Im ok with it. I only have one kid left and hes going to college. The other one never got a special vaccine for the correct strain in 2001. You know the flu that a- people still say more people die from to justify whatever. Ill show a card at my business too.",0.155737704918033,0.844262295081967,"Negative"
"1054"," Did she have any problem with your daughters routine childhood immunizations? If your daughter stepped on a rusty nail, wouldnt your ex want to be sure her tetanus shot was up to date? When she goes to college, wont your ex want her to get the meningitis vaccine?",0.286666666666667,0.713333333333333,"Negative"
"1055","    God forbid we let college students have the freedom to take, or not take, the vaccine.",0.732283464566929,0.267716535433071,"Positive"
"1056","Arizona Governor Issues Executive Order Preventing COVID Vaccine Mandates on College Campuses ",0,1,"Negative"
"1057","Dear Sir/madam,Its really very useful to arrange Vaccine CampAt Govt Arts College DharmapuriBut public are standing in hot sun. The queue canbeAllowed inside campus under treeAllocate more doctors and nurses for speedy vaccination  ",1,0,"Positive"
"1058"," Yes . Non vaccinated Students should where a mask and be tested so they dont pass on the sniffles. No healthy college kids died from lab produced covid. They died from vaccine-see 19 year old northwestern student who just died from vaccine. Untested vaccine.",0.170212765957447,0.829787234042553,"Negative"
"1059","   19-Year-Old College Freshman Dies From Heart Problem One Month After Second Dose of Moderna Vaccine.The CDCs Vaccine Adverse Events Reporting System Of the 900 cases reported,533 caseswere attributed to Pfizer,331 casesto Moderna and32 casesto J&amp;Js COVID vaccine.",0,1,"Negative"
"1060"," 19-Year-Old College Freshman Dies From Heart Problem One Month After Second Dose of Moderna Vaccine.",0,1,"Negative"
"1061","SLCC joins White House-led vaccine challenge ",1,0,"Positive"
"1062","Arizona Governor Issues Executive Order Preventing COVID Vaccine Mandates on College Campuses",0,1,"Negative"
"1063","    Myocardial side effects. All vaccines have risks. My ballet dancing 100 percent niece got long haul Covid19 symptoms. Luckily the vaccine is proving to prove effective in relieving symptoms. College student. Got it second semester.",0.80859375,0.19140625,"Positive"
"1064","Is it worth going to a university in AZ if dumbo . doesnt care if you sacrifice your life? Go to school in a state that cares if you live or die. Arizona executive order bans universities from requiring students to receive COVID-19 vaccine ",0.427927927927928,0.572072072072072,"Negative"
"1065","  Make plans to lose 30-50% of faculty to vaccine acquired covid and/or ADE, UC should make plans for its future as a community college, post mass vaccination...",0,1,"Negative"
"1066","      No one is trying to give young people heart issues. The article another troll posted said 226 college students had a reaction to the vaccine versus estimates of 900,000 Americans dead by  COVID.",0,1,"Negative"
"1067","Read the Nuremberg Code. Our government is violating it ",0,1,"Negative"
"1068","I had to send in my vaccine card from when I was a child in order to go to Arizona State so can yall PLEASE stop acting like vaccine requirements for college are brand new?",0.725,0.275,"Positive"
"1069","Massachusetts Announces $1M VaxMillions COVID Vaccine Lottery; If Youre Not Vaccinated, You Cant Play ",0,1,"Negative"
"1070","   sir to vaccinate the young 1 plz provide vaccine and doctor to colleges so that youngsters will get it ASAP, as data is all along with college of der students. Just keep n eye on dem nd no outsiders will be allowed except it will be a fst.",0.371428571428571,0.628571428571429,"Negative"
"1071","19-Year-Old College Freshman Dies From Heart Problem One Month After Second Dose of Moderna Vaccine-  #news #politics - ",0,1,"Negative"
"1072","19-Year-Old College Freshman, Simone Scott, Dies From Heart Problem One Month After Second Dose of Moderna VaccineAmong 16-17-year-olds, 79 cases of myocarditis and pericarditis were reported thru May 31. The expected rate is only between 2-19 cases!",0,1,"Negative"
"1073","  How can I go to college and know that I can bring back freaking covid-19 on my clothes to my house to my baby whos too young to get a vaccine? They should then make in person attendance non mandatory. I should have an option to take the classes online.",0.311688311688312,0.688311688311688,"Negative"
"1074"," Yeah I mean people cant give up to college tuition or their job, its a lot of money, so theyre going to feel obligated to get the vaccine if they want it or not.",1,0,"Positive"
"1075","You have right to say no to vaccine so college has the right to reject your exam qualifications also pal use brain wei ",0,1,"Negative"
"1076","Duceys executive order also mandated that students cannot be required to get a COVID-19 test or be required to wear a mask in order to be on campus.  Very irresponsible. 000s of students from all over US &amp; world, no vaccine mandate, no testing, no s. ",0.262068965517241,0.737931034482759,"Negative"
"1077","So it looks like people are going to be forced to get the covid-19 vaccine if they want to go to college or keep certain jobs, it seems like none of the representatives in office are doing anything to stop it.",0.625441696113074,0.374558303886926,"Positive"
"1078"," Your turn #Freedom #InformedConsent ",1,0,"Positive"
"1079","19-Year-Old College Freshman Dies From Heart Problem One Month After Second Dose of Moderna Vaccine #COVIDVaccines #CovidVaccineDeaths ",0,1,"Negative"
"1080","Doug Douchey strikes again!!CC:   executive order bans universities from requiring students to receive COVID-19 vaccine",0,1,"Negative"
"1081"," This guy is such a useless douche.  You can tell hes been bought and paid for more times than a bar of soap in prison.  Nice political legacy.  #ArizonaGetsScrewed ",0.245901639344262,0.754098360655738,"Negative"
"1082"," Sir my kids are in university and college all of them are asking that they be vaccinated in order to attend I applaud I work in a hospital we get every vaccine known to mankind because we dont want to infect a sick person Covid vaccines included we wont do elective to non vaxx",0.396825396825397,0.603174603174603,"Negative"
"1083","    Proof of vaccinations have always been required in primary or secondary schools. In fact meningitis vaccine is recommended because of close quarters in college. The threat of lower enrollment is a joke, that youd try to float that because schools want to protect is ridiculous",0.494845360824742,0.505154639175258,"Negative"
"1084","19-Year-Old College Freshman Dies From Heart Problem One Month After Second Dose of Moderna Vaccine. ",0,1,"Negative"
"1085","And when it all goes to hell, will you be able to tell me sorry with a straight face? ",0.24390243902439,0.75609756097561,"Negative"
"1086"," Thank you so much for this tweet. My college aged son received J&amp;J while away at school. We talked to our family doctor about possibly getting him mRNA vaccine. Physician discouraged him from doing this due what Dr. described as strong adverse effects.",0.527777777777778,0.472222222222222,"Positive"
"1087","$7 million in prizes: thats how much Mass. residents who have been vaccinated could win, including 5 $1M prizes and 5 college scholarships. Registration will begin July 1. Heres more details from  Statehouse reporter : ",1,0,"Positive"
"1088","Ok reading about Joints for Jabs, free lotto tickets, free college and all the various #vaccine incentives has taught me one thing: The next time a deadly pandemic shows up Im holding out on my vaccine!! A bitch feels cheated.",0.625698324022346,0.374301675977654,"Positive"
"1089","    I had the same thought  we had to make sure college kid had all childhood/teen vaccines &amp; meningitis vaccine before they would even let him on campus!!",1,0,"Positive"
"1090","you think they care  what  is happening  to  our   nation   college  people   our future  leaders      one  wonders   if they  vote  or  got vaccine  this was  Boca  bash     few weeks  ago  its their  future  at stake ",1,0,"Positive"
"1091","Oregonians (18+) whove received at least one dose of COVID-19 vaccine are eligible to receive prizes including one $1 million grand prize. Five 12to17-yr-old vaccinated Oregonians will win a $100,000 college scholarship! Vaccine info here ",1,0,"Positive"
"1092","   The point is a college kid is more likely to die ina car accident than die form covid! And at the myocarditis rate, they are going to be more likely to die from myocarditis with a vaccine than they would from covid..but hey, lets sacrifice a few kids for the greater good, right?",0.256578947368421,0.743421052631579,"Negative"
"1093","Have you heard?  has joined over 500 colleges and universities to participate in the COVID-19 College Vaccine Challenge, an initiative by the    and .Read about campus vaccine requirements here:",1,0,"Positive"
"1094"," Trolls? 1. Start with VAERS. 2. Speak to parents who lost their college age students to vaccine induced Myocarditis (RIP Simone Scott). 3. Speak with Dr.  Bhattacharya, Dr. Risch, Dr. Peter McCullough, Dr. Noorchashm, Dr Kuldorff 4. Become familiar with  Nuremberg code.",0,1,"Negative"
"1095","WHY??? A New Jersey student whose college, the New Jersey Institute of Technology, requires all students to be fully... ShotUp.  Hopefully they will pay for their crimes.",0.715151515151515,0.284848484848485,"Positive"
"1096","Great piece that universal mandates for college students is against medical ethics. These schools have their students between a rock and a hard place ",0.745,0.255,"Positive"
"1097","  The available vaccines are showing important side effects to young people.  Why NVAX is not receiving the same expedite treatment as Moderna received last year? Why college students are forced to get an mRNA or JNJ vaccine?",0.349206349206349,0.650793650793651,"Negative"
"1098","Please stop mandating this for College Students.",0.510548523206751,0.489451476793249,"Positive"
"1099","    the governor of AZ just signed an executive order to protect the rights of students from having to have a vaccine in order to attend college. No shot no mask nothing. Does our worm of a governor have the balls to do the same? ",1,0,"Positive"
"1100","19-Year-Old College Freshman Dies From Heart Problem One Month After Second Dose of Moderna VaccineSimone Scott underwent a heart transplant one month after developing what her doctors believe was myocarditis following her second dose of Moderna. ",0,1,"Negative"
"1101"," This seems embarrassingly low for a multi-billion dollar industry that thrives on availability of its players.  These men should have had some college education and have vaccinators coming to them unlike the general public.   They all likely had vaccine requirements for college",0,1,"Negative"
"1102","Again: NO ONE IS FORCING YOU TO GET THE VACCINE. You dont have to go to college. ",0,1,"Negative"
"1103"," 1) Find me a study that says college students have a high risk of dying from covid and 2) No where in my tweet did I say to not get the vaccine? ",0,1,"Negative"
"1104","    I suspect Dumper has a lot of love for you.Do you also believe Dumper created the vaccine?  Im gonna need you to sign up for some college courses ",0.484149855907781,0.515850144092219,"Negative"
"1105"," The vaccine is EXPERIMENTAL and has not been approved by the FDA. I have college kids. I would not want them taught by someone who cant use their brain to see through the Covid 19 vaccine bullshit.",0,1,"Negative"
"1106"," But our 16yr old son that doesnt have health issues really wants the vaccine before he starts college yet theres still no information for when/if he will qualify for it!",0,1,"Negative"
"1107","  You dont want the shot? Fine. I dont care. Get sick. Die. I dont care. You mad the choice. If a business says you cant work there without the shot, get another job. A college says you cant attend without the vaccine, transfer. You have choices. Deal with the consequences.",0.407017543859649,0.592982456140351,"Negative"
"1108","  Wow, your I know you are but what am I comment to  is so clever . . . Not!!Did you not hear Ducey\s EO???Looks like you need to find a new job! ",1,0,"Positive"
"1109","19-Year-Old College Freshman Dies From Heart Problem One Month After Second Dose of #Moderna Vaccine",0,1,"Negative"
"1110","In a new COVID-19 College Vaccine Challenge, the White House and U.S. Department of Education are asking higher ed institutions to make a commitment to help get their students and communities vaccinated. ",1,0,"Positive"
"1111","  NO ONE is saying that. At risk people should get the vaccine. But it should be a personal risk assessment. It should not be mandatory to attend college, especially when the vaccine causes more harm than good in that particular age group.",0.251592356687898,0.748407643312102,"Negative"
"1112","Drury University announced Tuesday that students will be strongly encouraged, but not required, to be vaccinated against COVID-19. ",1,0,"Positive"
"1113"," You dont need an emergency use only vaccine to go to college.",1,0,"Positive"
"1114","My fit and healthy 21 year old ended up in major trauma at kings college hospital tonight with a severe reaction to #PfizerVaccine do our kids really need this vaccine whats the chances of this happening to other young kids #COVIDVaccination",0.551724137931034,0.448275862068966,"Positive"
"1115","In the latest bid to convince vaccine hold-outs, Massachusetts will offer five $1 million prizes and five $300,000 college scholarships to fully vaccinated residents. #mapoli",1,0,"Positive"
"1116","brb gonna scream into the literal void ",0,1,"Negative"
"1117"," continues to provide how incompetent he is with his mismanagement of the COVID vaccine program by not requiring that college students be vaccinated. Thankfully he cant be re-elected!",0.451612903225806,0.548387096774194,"Negative"
"1118","The new executive order from the Arizona governor says students cannot be mandated to take the COVID-19 vaccine or submit COVID-19 vaccination documents.  You cant make this shit up.   ",1,0,"Positive"
"1119","Jennifer Block: Broad mandates in the civilian population of an unapproved Emergency Use Authorization product (COVID19 vaccine) are unprecedented, the legality may ultimately be answered in court.All risk for &lt;60 crowd.#NoVaxCoercion#NoVaxPassports",0,1,"Negative"
"1120","Professors warn mandating college students get COVID-19 vaccines violates medical ethics, say schools should not treat them like guinea pigs ",0,1,"Negative"
"1121"," Im busting my ass so he wont have to go to college lol. But if he wanna go then thats his choice, if he wanna get the vaccine thats his choice. But while hes a child fuck datttt",0.236453201970443,0.763546798029557,"Negative"
"1122","Whats wrong with this jerk??? How does that make any sense???The new executive order from the Arizona governor says students cannot be mandated to take the COVID-19 vaccine or submit COVID-19 vaccination documents.",0,1,"Negative"
"1123","Beautiful 19 year old girl college freshman dies of heart problem after taking the jab ",0.590504451038576,0.409495548961424,"Positive"
"1124","I find these vaccine lotteries fascinating, because the only incentive I needed to get the vaccine was the probability of surviving this pandemic, but if I am one of the million $ winners I wont say no ",1,0,"Positive"
"1125","Listen folks. This *will* cost lives. Mandating proof of vaccinations for enrollment in college is *not* new. Its been a thing for a long time, for many vaccinations. Please, please, please - still get your COVID-19 vaccine ",1,0,"Positive"
"1126"," And yet college students are required to get the mmr vaccine before college. This isnt any different. Why do you always choose to not follow science but then encourage people on a commercial to get a vaccine. Master of double speak.",1,0,"Positive"
"1127","19-Year-Old College Freshman Dies From Heart Problem One Month After Second Dose of ModernaVaccine ",0,1,"Negative"
"1128","   Guidance by the Royal College of Emergency Medicine:",0,1,"Negative"
"1129","   And thats why the CDC is having an emergency meeting 6/18 RE vaccine side effects  - young men and Myocarditis? Easy for you to dismiss if you dont have a young man having to give up his rights or his health to attend college.",0.526315789473684,0.473684210526316,"Positive"
